BRA,Summary
No,Firefox adds http:// and / when browser.urlbar.trimURLs = false and keyword.enabled=false
No,Consider making FX_URLBAR_SELECTED_RESULT_TYPE opt-out
Yes,Inconsistencies with visual cue used for remote controlled browser session
Yes,Users can be tricked into thinking sites are encrypted with new visual cues added by bug 417844
Yes,Metro firefox needs a visual cue when a URI is loading
Yes,no visual cue on how to exit customization mode in UX builds
Yes,[Linux] No visual cue as to what item is selected via keyboard navigation in in-content preferences
Yes,Most visited tab displays the URL of IDN in Punycode transcription.
Yes,Text referencing Talkback in about:license should be removed
Yes,Talkback installer percent should be set back to 20% for final-ish releases.
Yes,Installer Does not close Mozilla gracefully; Talkback pops up
Yes,Crash; Talkback window has no buttons
Yes,Talkback is unable to connect to report crashes
Yes,Talkback server needs to be functional for final 1.5 release
Yes,Talkback is not installed with the installer
Yes,"Talkback ""not compatible"" with 1.6a1"
Yes,crash (see Talkback event TB11273741W)
Yes,Talkback is not triggered on Firefox crashing
Yes,Talkback fails to remember settings
Yes,"Firefox crashes on startup, Talkback does not trigger."
Yes,Crash on startup with Talkback enabled using XP x64 SP1 [@ msvcrt.dll + 0x48cc3 (0x77be8cc3)]
Yes,FireFox sometimes crashes (opens Talkback) when closing while applet running [@ IM_get_input_context]
Yes,DOM inspector and Talkback not installed in trunk
Yes,Firefox not starting with the Talkback extension enabled
Yes,"FireFox crashing on this site, Talkback agent *does not* catch this crash"
Yes,Quality Feedback agent (Talkback) does not come up when Firefox freezes
Yes,Talkback no longer working
Yes,Javascript popups crashes Firefox when Talkback add-on is enabled
Yes,shut down Firefox by data execution prevention no Talkback
Yes,Talkback network error -- processing failed
Yes,Set Talkback random percent to 100% for nightly builds
Yes,Installer chokes on Talkback : -214 DOES_NOT_EXIST
